id,artist,date,source_url,text
AT18,3,2018.0,https://artadia.org/news/awardee-spotlight-a-dialogue-with-mequitta-ahuja/,"Going back to my adolescence, my story is that I have a relatively unique cultural heritage—I am African-American on my mother’s side and South Asian Indian on my father’s side. In the United States the conversation about race is almost always black and white. If somebody is mixed-race, we assume they’re mixed black and white, not two non-white ethnic groups. Often, I felt like an outsider, and for a long time, creating a visual unity of my cultural heritage was the subject of my work, but as I aged, those concerns receded. At some point, it no longer felt important whether or not I fit other people’s expectations. As those concerns faded, I needed to reinvent my work, and to do that, I needed to expand the terms of the self-portrait. The genre of self-portraiture, especially when it is an artist of color or a woman, is circumscribed by identity and its politics. It became important to me to move self-portraiture, as a genre, away from identity and toward a discourse on representation. That transition is about authority. Because we as women, and we, as people of color, are not only experts on ourselves and on our social condition. I am also an expert on art. My paintings tell you what you need to know about paint – its form, its conventions and its history. As women, as people of color, we can have that authority. I picture it.

The impact of these kinds of awards, the Artadia Award or the Guggenheim Fellowship, which I was awarded this year, is three-fold – status, money, validation. As artists, we figure out how to work when any or all of these is in short supply. If we’re lucky, we get occasional infusions of one or another, enough to keep us afloat. For me, the most profound impact of any of these kinds of prizes (when you get them and when you don’t) is always existential and psychological – they contribute to the shape of the story we tell ourselves, about our efforts, our lives, our purpose and those stories are either fuel or weights. Often, it fulfills a need we each have to construct our personal narratives of success and overcoming challenges. The stories we tell ourselves have both psychological and practical outcomes. The confidence they impart makes us better at what we do. It also challenges us to live up to them. Once we receive recognition, we have to prove we deserve it.

In my works, I position a woman of color at the center of a discourse on representation. I established this objective from my study of art history. It is my assertion that the entire figurative painting tradition can be summed up this way: the figurative tradition is the unseen made visible through a meaningful fiction. Unseen because it happened in the past or away from public view or in the mind of the artist or the sitter. And meaningful fictions include all the mechanics of illusionism such as one-point perspective, or a single source of light, as well as the conventions of painting established and reinforced over the history of painting – ideas like, painting as a stage set established by a pulled back curtain, or using architecture to frame a narrative, or depicting a piece of paper as a trompe l’oeil or “trick of the eye.” I consciously make use of painting conventions to position my work in dialogue with the figurative painting tradition. Often, I include elements in the work that reveal its character as a construction self-consciously staged for a viewer.

In my new work I’m addressing domesticity, the body and painting – painting as an act and painting as an object. The work I exhibited in 2017 at the Walters Art Museum was the start of my imagery depicting paintings within paintings. I’m continuing that theme because it allows me to explore the full range of my medium – its full formal and pictorial history. By creating a contrast between the painting’s overall figurative style and the style of the internal painting – the painting within the painting, which ranges from naturalism to folk art to text, I’m able to work expansively across pictorial idioms. Working this way forces me to expand my skills and my references. In my most recently completed painting, “Seated Scribe,” I was influenced by the artist Corita Kent. The process of working on this painting opened up areas of art and art history that I’d barely visited. Before working on the canvas, I first had to wrap my mind around a graphic design problem – how to make something legible that also worked as an abstract pattern. This is not a problem I’d tackled before in painting, so I spent a lot time drawing letters, cutting them out and arranging them on paper then trying to approximate a printmaker’s graphic flatness in colored-pencil drawings before moving into my final painterly approach to the text.

For me, painting, it’s practice, it’s mechanics and its history, is a lens through which I view everything. My daily concerns are formal – questions of mark and surface, structure and space, color and shape. My body of work documents my development as a maker and as a thinker. I want my viewers to see what I see and to see how I visually problem solve, which is a way of thinking. I want the viewer to see me in my process of thinking and painting, painting and thinking."
AT19,3,2018.0,https://www.itsnicethat.com/articles/mequitta-ahuja-notations-art-310518,"I am African-American on my mother’s side and South-Asian on my father’s side. I use my work to unify my mixed heritage. As I got older, concerns about my identity become less pressing and, instead, I find myself reflecting on self-portraiture as being about the artist as a picture-maker. In other words, I increasingly focus on the artist’s self-portrait as a discourse of representation.

I show my protagonist at work – reading, writing, handling canvases in the studio – and I show the work itself, the mark, the assembling of marks into form, the brushstrokes. In these ways, I replace the common self-portrait motif of the artist standing passively before the easel. I alter and re-contextualise imagery to illustrate the mental work of paintings.

My subject is almost always a female artist of colour. By positioning a woman of colour as a primary image-maker, I knit my contemporary, personal and painterly concerns into the centuries-old conversation of representation.

This exhibition is in part a proxy visit to my studio, but it’s also a visit into my mind. You are able to see my interest in painting as a practice, as a historical narrative and as an object."
AT20,3,2020.0,https://www.artmuseumgr.org/collection/portrait-of-her-mother,"I sought to make a body of paintings out of the love I felt for her. My mother did see a lot of the work and got to see how much she inspires me. In the painting, I am holding a drawing I’ve made of my mom, so you get the whole story from this one painting."
AT21,3,2021.0,https://www.arts.gov/stories/podcast/mequitta-ahuja#transcript,"
I love that oil paint can do anything, that you can make it look like anything.  So it feels to me like it has pretty infinite possibilities.  I feel that you can discover the world through any intense focus on anything and for me, my interest is doing that with painting

Kerry was my advisor in graduate school, and he has had the single most profound influence on my development as an artist.  His philosophy is that of mastery.  Mastery of the techniques as well as the knowledge base of one’s field.  It’s a slow process, a lifelong process, and when I’m painting and drawing, I’m still processing things Kerry said to me 5, 10, 20 years ago.  I visited his studio several years back and I showed him some images of my work, and for one of the paintings he said, “Too many of the elements are inert,” and Kerry’s never trying to be cryptic.  He’s very interested in clarity and in demystifying artmaking, but he brings so much information to each thing he says that if you don’t have comparable information, many of the things sound like riddles.  So this, you know, phrase, “Too many of the elements are inert,” like, what does that mean?  It’s not a moving picture. <laughs> It’s a painting.

And this was a painting, by the way, that has done well in the world.  It’s been collected by an institution, an art historian has written about it, but of course for me, Kerry’s critique is the story of the painting, and then fast-forward.  This past fall I was working on a new painting and it was far along and that word came into my mind, “inert.”  It’s been six years since Kerry’s critique, and it’s not like I paint infrequently.  I’m full-time in the studio.  It took me six years to see it for myself.  I have enough experience and knowledge to look now and not just understand theoretically what that could mean but to actually name it when I see it.  That element is inert, and once I diagnosed the problem, even if I didn’t know immediately how to improve, you know, I know what to look for.  So how’s the temperature of the color?  How’s the weight of the line?  If I were to take the shape out of the painting, is it an interesting shape?  And, you know, by answering these kinds of questions, I’m then on my way to improving the painting.  So multiply that kind of slow learning by a hundred and that’s Kerry’s influence.  It’s lesson after lesson.

I was born in Grand Rapids, Michigan.  I don’t remember it.  We left when I was quite small, and I’ve lived in a variety of places.  Mostly it’s my art that has taken me to all different spots, so I spent some time in Chicago, where I went to graduate school. I then went to Houston, Texas, where I did the Core Program.  I then moved to New York, where I did the Studio Museum in Harlem residency, and then a residency brought me to Baltimore, Maryland, at the Maryland Institute College of Art, and when I was there I met my now-husband, and we have recently moved to Weston, Connecticut, which is where I grew up.

No.  I came to art through all the things that you do as a little kid that have anything to do with marking a page, really.  Coloring books, doodling, handwriting.  I didn’t grow up with art or around artists.  I didn’t go to art museums really as a kid.  I remember at the grocery store they had a wall of coloring book pages, submissions for coloring book competitions, and I remember that that was something that I liked.  I liked things that other kids made.  I didn’t think about the history of art.  I just liked to draw, and I wanted to be good at it.  I wasn’t particularly good at it in terms of natural talent.  I don’t think I had that.  What I had was keen interest, and my parents were supportive, but mostly they just didn’t stand in my way.  My mother bought me my first easel, which I still use.

I love that oil paint can do anything, that you can make it look like anything.  So it feels to me like it has pretty infinite possibilities.  I feel that you can discover the world through any intense focus on anything and for me, my interest is doing that with painting.

That’s right. I feel that my work has a kind of dividing line, however, so I have a whole body of work where that identity very much was the central focus of the work and specifically sort of making a whole out of these disparate elements, and then I kind of came to the end of that projects.  You know, as you get older, to some degree, the idea of, “Do you accept me?  How do I fit with your categories?” these things become less important, and I became interested in what else I could do with the genre of self-portraiture.  So really thinking about moving self-portraiture away from being about identity, being about the self, and moving it towards ideas about representation, pictorial representation.  So how to make painting that, yes, positions me as I am, as a woman of color, but to not necessarily only talk about that.  To not necessarily only talk about my social condition but to also take an authoritative position in relation to art.

Yeah.  Some of my ideas for self-portraiture really came from the self-portrait of Poussin.  It’s a 1650 painting.  I always find that I kind of go to these uncool parts of art history and I sort of-- that works for me.  I kind of align myself with things that are uncool and I kind of don’t even like the idea of cool or the way that art is supposed to be cool or somehow being black is supposed to be cool.  I dismiss both of those as limiting stereotypes, and this, you know, 1650 self-portrait by Poussin is really a kind of a fuddy-duddy, but it’s of central importance to me, and he, in that painting, presents himself as a painter, as an authority within the realm of art and presents himself with paintings.  So some of my ideas, this is where, you know, they come from, and it’s really from Poussin that I get this idea of presenting the artist as a, you know, authority within the field.

Honestly, it was pretty basic reason at the start, which is I wanted to deal with a figure as a painter and I was a ready model.  So I think at first it was very much a practical solution and once I got going in the mode I wanted to see what was all the territory I could explore there.

Yeah.  So to some degree that’s still part of my process.  So I take these photos that I use as source material and then through a process of drawing I work out the whole scene and eventually then begin on a canvas.  You know, one thing that we could do is kind of walk through one painting as an example.

Okay.  So <laughs> my painting, “Portrait of Her Mother,” tells the story of my recent body of work and how that body of work was inspired by my mother’s illness and death.  She died on May 3rd, 2020.  My mom had cancer.  She had a type of cancer that any of us could develop, and I somehow feel there’s a beauty to her cancer, that it suited her.  The same process that allows for cell repair for life, for growth, for healing, can become exaggerated, and that’s what killed my mom, and that idea of creation and destruction makes me think of an idea of the divine in Hinduism, a making, breaking cycle, dance, of life and death.  So I started making a new body of work when my mother was sick.  It was drawing as a process of grieving, making something out of loss, and I found a process, a material parallel to loss, by scraping away paint.  So in a series of oil sketches, I put down a layer of paint and then I drew into it, so pulling the paint away, scraping the paint away, to make my imagery, and my mom’s body was changing rapidly, and I had these photographs that I’d made nearly two decades earlier when I was in graduate school.  I took photographs of myself and my mother both nude as source material for a painting I was working on back then, so I went back to those photographs and I used them as source material for this new body of work, specifically for these single-color oil sketches.  Most of them are either red or blue, and I then made a few large paintings based on those sketches.  So in the painting titled “Portrait of Her Mother,” I show myself in my studio with two of my large, monochrome figure paintings, one red, one blue, both of which are using this method of scraping away paint, and both are based on this idea in Hinduism of creation and destruction, and I show myself standing in front of these two paintings holding a drawn portrait of my mother.  So you get the whole story from this one painting, and I think about the painting as describing the way that it was made.

Expectation maybe is minimal. My hope is that there is enough clues there and to some degree it depends on whether the painting as exhibited as—alone; is that my only work in the space or it contextualized with other work. I believe that somebody even just seeing this work alone could probably guess that that is a portrait of the artist, that the woman in the painting is not a sitter for the painting, not a model for the painting but is actually a representation of the artist by the artist; I feel that that’s implied by the table of paint and brushes there. And again if I think about even just the rendering of my mother’s portrait now obviously somebody’s not going to say, “Oh, I see that her mother passed away from serious uterine cancer,” but the title of the painting combined with the way that I’ve rendered her portrait I think shows the sense of loss and even just the intimacy of the way that I’m holding the portrait and presenting it to the viewer, the kind of look on my face, on her face I think, I hope projects that sentiment and even further, deeper story, how centrally important my mother is to my life. Our bond was tight and unique of mother-child relationships I know and I want that also to be implied, visible in the paintings, that I felt inspired to make a body of work out of this loss and out of the gain, out of the relationship, out of the love.

I do a lot of preplanning at this point and drawing is such a central part of the process of making these complicated paintings. So take a painting like “Portrait of Her Mother,”  it’s essentially four figure paintings-- and arguably two, three different kinds of approach to the figure, and so for each of those I had to work out that notion of painting before I got to the canvas so the head of my self-portrait -- I rendered that fully as colored pencil on drafting film. The portrait of my mother that is a drawing with a bit of pastel I fully worked that out actually in several different iterations while I was searching for the kind of way to represent her, and I wanted to find a way of drawing that signaled to the viewer that there was a sense of loss, that there was a kind of feeling of nostalgia so I was looking for a-- an idiom of painting, a mode of drawing that would express in the form this kind of feeling of loss. So first I had a more photographic rendering of that portrait and that felt wrong to me and then I had a full-color very similar to the way I painted myself rendering and that felt wrong to me. I really needed to take it down to this it’s not exactly an outline but something close to an outline with just a small bit of color so even that lack of color gives you a feeling of loss.

Right, although I didn’t think of it <laughs> until far along; These paintings exist-- the blue painting is the blue figure painting in the back exists as a separate painting. The red painting of the figure, which is a kind of shiva dancing figure, that exists as a separate independent painting. And this really is how things were kind of laid out in my studio one day and I thought I can tell the story of this work through capturing the scene.

Yeah.  You know, it’s interesting.  Like, a lot of people don’t want their children to pursue art out of a fear that they won’t be able to support themselves, but I think that if-- especially if you’re well-educated, and particularly if you don’t have children, I think you can live well on modest income.  You don’t have to live in New York.  You don’t have to buy a house.  You can take your time and develop your craft, and that’s what happened for me.  That’s how I did things, and over time I have been able to afford a reasonable life.  Now I have a child.  Now I own a house, but, you know, I didn’t do those things in my twenties, so, you know, back when I was finishing school I did work with local arts organizations as a teaching artist and I-- my landlord actually let me use a space in the bottom of our apartment building that I used as my studio space.  It was unheated in Chicago, so you make it work.  That’s kind of, you know, one of-- another lesson from Kerry.  He would always say, “Work to the limits of your resources,” and that meant work as large as you could get your painting out the door, and it meant work within your means but, you know, well within your means financially and kind of in every sense of that word of resources.

So it was so amazing to be at the Studio Museum in Harlem.  It was my first time being in essentially an all-black space, and that was very nurturing for me.  It’s an incredibly nurturing environment.  Everybody there is supportive, especially of the artist in residence, so it really feels like they’re all rooting for you, they’re all looking out for you, and that was just an amazing time for me.  Now, does where I live impact how I work?  I would say largely no.  I would say I’m somebody who lives in my mind, and to some degree that doesn’t matter where my mind is. <laughs> I feel that the work that I make is grounded most fundamentally kind of in my mental space.

Yeah. So again that kind of goes back to my earlier body of work where I was using for many years this word “automythography” to describe a kind of process of identity formation, which I defines as not just something sort of natural to you or that you were born with but that you were involved in your own process of becoming and that that was a combination of nature and culture and place and your own creative imagination so that was the piece that I was most interested in is this kind of agency that we have in not just who we are but how we are in the world and to some degree how people perceive us.

Yeah. Another kind of uncool historical idea that I find myself drawn to is didacticism. When I was in graduate school that was the worst thing that someone could tell you about your work, that your work was didactic, and so of course me being me I’m like “All right. Well, let’s see what we can do with didactic painting.” That’s actually an idea I’m really interested in. What if you break all of the rules of modernism and think about painting as a text, as a narrative, something that explains itself like the Rosetta stone? It has everything you need to decode it not because it’s so reduced that all you have is a surface with pigment but like I described in Portrait of Her Mother because it tells its own story.

Well, we have these contemporary notions about self-portraiture being about the self and being about identity especially if you’re talking about a woman or a person of color, that women and people of color are so often asked to mine our personal biographies as case studies in our social condition, and that’s interesting to me but I’m also interested in these earlier, more historical notions like presented by Poussin’s 1650 self-portrait, these other kinds of ideas of what self-portraiture can do. So I’m interested in doing both and not not talking about the self but to not only talk about the self.

Oh, my work changes a lot and so to the extent that the way that I work has to match that-- those changes those shifts happen frequently and certainly becoming a mother has put a lot of new restraints on my time. I have always been a morning person but I’ve become a hyper morning person so that I get to the studio first thing in the day before anybody else in my household is up, and I find that that keeps my head in my work even if I’m then not able to get back to the studio for another six hours and that kind of sets my focus for the day and I’m able to get a number of hours in in the studio even with a toddler. We do have some baby-sitters that come but at this point we had expected to probably enroll our son in some kind of daycare but given the pandemic we’ve held off on doing that.

I find every emotion being in the studio, truly every emotion including ecstasy and including despair.  This work while my mother was ill and through losing her certainly every feeling was there with me in the studio; I was working through those feelings. My mother did see a lot of the work, which-- I’m really glad that she was able to see how much she inspires me, but I would say that kind of emotional intensity it fluctuates a lot in the studio, it’s-- I’m not always in some kind of extreme emotional state, but those-- that kind of emotional intensity I’d say is pretty constant and consistent since I’ve started making art when I was a kid.
"
