id,artist,date,source_url,text
AT31,4,2008.0,https://kipfulbeck.com/global-hapa-a-conversation-with-kip-fulbeck/,"The word “Hapa” comes from the Hawaiian word “half” which is in itself a form of the English word half; Originally used in the term “Hapa Haole,” it referred to someone who was half white/foreigner and half Hawaiian. At some point, it was a pejorative term, implying that one was not pure but by the time I heard it in the early 1970’s, it had come to mean someone who was part Asian/Pacific Islander and part something else. Many people argue about what word means, but in terms of language, no one “owns” anything.

Some people I’ve met tell me “Hapa” means only Japanese/Caucasian. Others say it’s only Hawaiian/Other, etc. I just think it’s a nice, casual way of describing being mixed. A lot less clinical than Eurasian or Amerasian. And it has no pejorative attachment, like “Ainoko.”

My main objective, selfishly, was to make the book I wish I owned when I was a kid. I never knew anyone else like me, going through things I went through, not fitting in, always having to choose sides.

I also wanted to give Hapas a forum to describe themselves in their own words, and to choose their ethnicity in their own terms. Identity is a personal process and I’m adamant that it should be a personal decision, not one made by a community, a government or others.

I don’t think of it as negative or positive; it’s what it is. I think taken to an extreme it can be negative, as in ‘I’m going to vote for Obama because he’s half African and I’m part African.’ The problem is that the world identifies you by phenotype, race, and ethnicity. I would love not to have to make this book, but the reality is that every day people are looking at you and making assumptions based on what box you fit in … and for multiethnic people, these boxes are often blurry.

The boxes are there to categorize other people in order to simplify social complexities; it’s a social mechanism. But why the “race” category? And if the categorization of people is an inevitable social impulse, how should we do it?

For the record, race is not a scientifically sound assumption. For example, there is no DNA difference between human beings. We are all African. Biologically, race does not exist. It is a social and cultural construct.

The U.S. is a country with a long history of social genocide (Native Americans, African slavery, etc.) and this was all due to the seeming differences we attributed to race. Yes, it is very convenient to categorize people according to race. It is also extremely inaccurate, however.

Right now, with our election, I watch CNN and they talk about the Latino vote, the Asian vote, the Black vote, etc. Obama is a “Black” candidate when in reality he is multiethnic (as are probably Clinton, McCain, etc. if you go back far enough in their genetic lineage.) Am I part of the Asian vote or the White vote? The whole ignorance of multiracial/multiethnic people is ludicrous.

You can’t really. And I’m not really sure you should even try. At some point, we are just animals, and all fashion is , when you get down to it, is silly trends. One decade we like straight hair, another curly; women should be voluptuous or waifs, men should be hairy or hairless; And then we spend $300 on jeans that have a different cut so we can be in fashion again.

I’m as guilty of this as the next. I think it’s a good idea to be aware of it though and not take yourself too seriously. That’s something I see in a lot of younger artists and activists, myself included.

Yes, certainly in Japan and the U.S. There is a public thirst for mutli-ethnic models. In Japan, the Hapas I have seen, however, are almost always Asian/Caucasian mixes. I think it’s a bit of the exotification of the difference; Being different enough and yet not too threatening.

I think colonialism is alive and well, and not just because the U.S., U.K., Netherlands, Spain, etc. traveled by ship long ago, but because Universal, Microsoft, Rupert Murdoch, MTV, etc. are all in the U.S. and have American points of view. We can’t win an ill-conceived and illegal war in Iraq, but we’re still able to put Britney Spears in most every household in the world.

I think it’s a long way from anything. There is barely a growing awareness here. Xenophobia isn’t going anywhere anytime soon. I actually think it has more to do with education and media than anything. As long as we are being fed corporate propaganda about what is or isn’t newsworthy we are always going to slip into the easy/lazy route of thought (witness the whole internet campaign against Obama because his middle name is Hussein).

I think it would be received with positive stereotypes (oh look, they’re so kawaii, etc.) which is why in my project I include all sorts of Hapas. The book is full of all sorts … fat, tall, ugly, short, beautiful, weird, etc.

I’d leave it all open to them. All my subjects are volunteers, so I’d see what they’d want to come up with."
AT32,4,2006.0,https://discovernikkei.org/en/interviews/clips/489/,"I don’t really like other labels put on me. When you self-identify, that’s your choice, and that’s the great thing, if you want to identify as whatever it is you do…I mean.

I remember I got a ticket the other day for having my dog on the beach and I got the “you people”. And I was like—‘cause whenever you get “you people” you’re now the minority, and “you people” can mean anything. When you’re, like, “You people,” you’re like—“Okay, I know where this conversation is.” So the guy’s like “I’ve been telling you people about this for a long time,” and I thought, “Okay, is ‘you people’ dog guys on the beach? Or is ‘you people’ surfers or brown guys or tattoo people or long-hair people?” or whatever it is, and I’m like—I asked, “What do you mean, ‘you people’?” And he just kept writing the ticket, he wouldn’t tell me.

And that’s when I realized there’s some label in his head he’s got going on. Maybe his “you people” is “you scofflaws who ignore the laws of our great country or city or whatever,” and maybe it’s something else going on. And so I choose to try to identify myself my way as much as I can."
AT33,5,1978.0,https://www.youtube.com/watch?v=T5eyKMEQizY,"The shape comes out working with the wire…
You don’t think ahead of time… this is what I want…
You make the line… a two-dimensional line…
then you go into space…and you have a three-dimensional piece.
It does not hide anything…and inside and outside are connected…
everything is connected… continuous."
AT34,5,2001.0,https://plusmagazine.net/in-minds-of-ruth-asawa/?utm_source=chatgpt.com,"As a mother and grandmother, I expected my six children and ten grandchildren to participate in the making of art as well as washing the dishes, taking the garbage out, weeding the garden, and building things. They have helped me on commissions and continue today to work with me on projects. Although most of them do not earn their living as artists, their lives have been made far richer because of this involvement. I believe in the lasting joy that making art can bring to all of us."
AT35,5,2006.0,https://www.davidzwirner.com/news/2020/ruth-asawa-line-can-go-anywhere,"I was interested in it because of the economy of a line, making something in space, enclosing it without blocking it out. It’s still transparent. I realized that if I was going to make these forms, which interlock and interweave, it can only be done with a line because a line can go anywhere."
AT36,5,2006.0,https://artsandculture.google.com/story/ruth-asawa-a-working-life-de-young-museum/nQUxgGBPp11bIg,"I don’t think of myself as Japanese. I think of myself as somebody with an idea, a human idea rather than an ethnic idea"
AT37,5,2002.0,https://www.aaa.si.edu/collections/interviews/oral-history-interview-ruth-asawa-and-albert-lanier-12222?utm_source=chatgpt.com,"Well, it was in 1946 when I thought I was modern. But now it’s 2002 and you can’t be modern forever. Modern artist. It’s a new group of people. And I don’t know them very well.

At that time I was experimenting before anything was called modern, at that time, just experimenting. But now it’s not . . . new experimentations are going on. And I feel way behind as an artist, not knowing about machines and technology.

Computers. I know nothing about that. But they are way beyond us now in what is happening in the arts now.

At that time, yes. At the time, doing the latest and trying things out. But I don’t feel that I’m in touch with it now.

Right. And I feel like my mother used to think of herself, as an immigrant not knowing the English language and feeling isolated. I feel in a way isolated from that time, now.

It probably felt as though we were ahead of the administration in that time. At that time we felt we were so beyond them.

Well, we were encouraged to try out new things at that time.

And maybe it was our youth that gave us that feeling at that time. But we thought we were given permission to try out new things in terms of the way that . . .

Materials.

The things that the administration was trying to do. They were experimenting and we were also experimenting at the time. And we were so poor that we were taking materials that were around us and using leaves and rocks and things that were natural rather than having good paper and good materials that we bought. We had to scrounge around with things that were around us. And I think that was very good for us.

Yes.

Well, it was through the teachers that we had who encouraged us to use things around us.

The same problems had a deeper, deeper feeling, experience.

A design course, color course and a drawing course; drawing and painting. Those were the three, I think, we had with him. So we had essentially only three courses. But we went year after year and had the same course.

I went three years and two summers. The summers were very important because we had a faculty that was not the usual year-around faculty.

Through ’49, yes.

Jake Lawrence was there, yes. He didn’t teach. He didn’t teach me. He might have had some students but he was just there visiting.

Yes.

Well, we were like friends, but not a class with him. And de Kooning was there too. He was there as an artist.

Yes. And Arthur Cunningham taught there.

Rauschenberg was a student with me at that time. And he was there for a year as a student. And then the summer he went to Europe, I think, that summer.

Yes.

It was a flaming with a torch. We ran down the hill and there was a field. It was Rites of Spring music.

Stravinsky’s Rites of Spring and that’s all I can remember.

Yes, and that’s all I remember dancing together.

We were just having, yes, we were also having a lot of fun.

Oh, he was really pretty nice.

Then as a student I would come up early morning to see the fog come up. We had Mae West, we had a model that looked like Mae West.

And then he would photograph that. Because he was interested in photography. I never saw any of those, but they were photographs of the fog coming in. And it was clear in the very beginning, at 6:00, and then it would get very, very foggy, the fog would cover the mountain. And many, many times I just went to his house and knocked on his door. He woke up, went out to photograph, and then he went back to sleep.

Yes.

I got him up.

And then I used to make butter for the college from the milk and the cream.

We all had to work, yes. So it was my job to make the butter. And then I made the buttermilk. Europeans loved buttermilk. That made me very popular with him and with Mrs. Albers and with the Europeans who drank buttermilk, which was not something I liked.

No, I never drank it. I never drank it. But they liked soft butter. And they loved the buttermilk.

Well, for me I liked the rigid and the things that I learned from him. I wasn’t very much with feeling because I had come from a culture that didn’t think very much of one’s feeling.

Right. You don’t display it.

Yes. And that’s why it appealed to me. He appealed to me a lot.

But formality, I don’t know what it was.

Yes. He was different. He was very, very different.

He was a very sensuous, his sculptures. And Albers did that on purpose. The things that he didn’t have, I mean, that kind of feeling he invited people with that feeling.

I thought he was more of a feeling person. Don’t you think?

He invited Peter Grippe who was like Peter Voulkos. Peter Grippe, G-R-I-P-P-E. He was a sculptor who did things with plaster and wire. Abstract.

Yes. And so Albers invited people that were very different from him, I think. Which was the nice thing about Albers.

No, that was . . . That they had come for.

Right. And Scar Bablioni and people who were very, very, very, very free. And had a lot of freedom.

I liked it as long as it was without the plaster. And the minute he put the plaster on I didn’t like it anymore because it became solid. I liked him and the framework that he was using.

Well, it was both he and Albers together, because Albers was always talking about transparencies. That is a modern thing. And he was always talking about making things modern with a point at the bottom instead of having pyramids. He would say, “Make the point at the bottom.” And it was Albers who taught us how to think modernly. And not in the old way, in old traditional way.

Yes.

Well, I don’t know. I thought we were working on modern things at the time, but we’re part of the Bio-morphic.

About beams.

Yes.

Yes, it was very, very, very much of a certain group of people.

Yes.

Yes. That was after, but he came to San Francisco with Yanagi, who was a folk art expert and Bernard Leach who was . . . And Marguerite who lives here. And they all came together here. That was at Rudolph Schaeffer’s.

That was at Rudolph Schaeffer’s.

’52.

Yes, Rudolph Schaeffer hosted that meeting.

And they said this was not a real piece. And they went through his collection. There were many that were not real. Pottery and things that he had collected over the years. And Yanagi was an expert at that time.

And I think he had made two pieces at Black Mountain while he was there. But he had not signed his work until 1954 when he was told to begin to sign by Hamada.

It was a lecture.

Yes.

She was mean.

Yes.

Yes, in 1948.

He came as a teacher. He was a substitute, I think. But I never knew who the other person was. But he came in the summer to build a dome and that was the first time he had these models. He wanted to build a dome there, and that’s when Albert was a student of his. And I became the barber for it.

And Buckey made a ring for me, a wedding ring.

Yes.

Mark wanted to know about Buckey.

The year that we met him was the summer of ’48, and Buckey came to build his dome. He wanted to use the students at Black Mountain to build his dome. And his dome did not go up. Then the following summer he came and he had different solutions for building a dome.

Institute of Design.

Yes.

Yes, Josef Albers had gone on sabbatical to Mexico. And I met him and Anni in Mexico the first summer in 1947. He had gone for a sabbatical.

Yes.

I went with the Quakers to a village. Quakers, yes. They had gone for health and art, and I went for the art.

Then they had the house group go, and I don’t remember the names. But we went to a village outside Mexico City. And that’s where I learned to knit and to knit with wire. And then I saw these transparencies and I went back to Black Mountain. And that was the year, 1947, ’48, when I studied and worked with Albers that year.

That year he came back to teach.

And I had spent some time with the Albers in Mexico.

And he designed some at the Bauhaus before that. And then he went to Mexico City and then he met Clarita, who was from Cuba. Escaping Cuba, so she came to Mexico City. She taught design and architecture.

There was no title to what we were trying to do. I mean, if you wanted that chair they’d say, “Go up there. There’s a wood shop there. You can make your own chair.” Or you could make a desk or table up there. They’d point to the wood shop and they’d say, “Make your own.”

And then you would think what kind of desk would you make if you had the wood and there might not be any wood for you so they say, “Well . . . “

Yes, there was John Cage on this side and there was Bodky on this side.

Yes. Art was at a high level. And living was very difficult for us. I mean, we lived in crude beds and crude desks and crude . . .

I was in the war surplus building. I had nothing to do with it, but I did have a room of my own, which was, at that time, even now you don’t have. You don’t have that isolation or the room that belongs to you.

In some ways it was in two worlds. You had a space that was your own and you could do with what you wanted. You could paint it any color you wanted. If you wanted it black you’d paint the room black.

Yes.

The first one was a veteran. And his name was Isaac Carter. And he was in the 442nd Infantry from Hawaii, which fought valiantly in Italy. The other one was Su Yung Lee, who was there because Chiang Kai-shek, who was thrown out of China and went to Taiwan, and me. I was just a farmer from Los Angeles. The three of us were treated very, very well at Black Mountain College, and as were the blacks. Mary Park and Jacob Lawrence and his wife, Gwen Knight.

It was only good inside the college. When they went out in the community, they really realized that there was still racism amongst blacks. And there were so few of us Asians that we were treated in a very different way.

Only during the war when we went through the country. And my sister and I went to Mexico in a bus and we got to somewhere in Missouri and we didn’t know whether we should use the colored toilet or white toilet. And so at that time we decide to use the colored toilet because we were colored. And we just remembered that as an experience of racial discrimination.

That was before Black Mountain.

No, after camp, going from Milwaukee down to Mexico City.

Well, there were two summers that I spent. One summer was before Black Mountain and one summer during Black Mountain that we went to Mexico City to study. Albers spent his summer there. And we met him there. And he and Anni took us to Chapingo to see the murals, Diego Rivera’s murals.

And we -- I had studied Mexican housing with Clarita Porset, who was thrown out of Cuba by Batista.

And my investment is in that city. It’s better for me to invest in San Francisco. I mean that if you have place invest in it and you make it good, then it’s better than being a little bit here and a little bit there, Chicago, New York. It’s better to be in San Francisco and work on being effective in one place.

I guess it’s like being, how do you say, big pond and a small fish, or big fish in a small pond.

It’s pretty big. I mean, at that time it was a small town. But now it’s gotten bigger and bigger and bigger.

Exactly.

Well, it was not from a social issue that we were married, because of different races. We had a common interest in the arts, and that brought us together, not being different. And I think that’s hard to explain to people.

And our children, even Addie says, “Well, I’m not Asian.” She’s not Asian enough because she doesn’t think of herself as Asian or Caucasian. She thinks of herself as a person.

And it’s in the way I keep thinking that it’s very dangerous to make Black Mountain as a reason for being unique or being a mixed couple as being unique. We don’t think of that part as being unique. We think we’re unique because of what we do.

I believe so. I think so.

The way you hear so often today is how parents don’t like their children and their children don’t like their parents, and they do this and they do that. I think that and we never had that because we valued what our own children did.

And now it matters more about money now. That this job is going to give you security. And we learned that security is only in the arts. It’s not how we live. It’s not like belonging to a union or health benefits, or whatever there is today.

And because we come from Black Mountain where those things meant less than they do to normal couples. I think that was easier for us to learn that part of what was important to a relationship.

I think it goes back to my parents. They knew how to work. They learned how to work. And they came to this country as immigrants and they had to work. And they taught us how to be good workers regardless of how we felt about anything.

So we learned primarily to work. That’s what was the thing at Black Mountain that helped me because I was a good worker and they needed workers, because most people were idea people, and I could scrub floors or I could do menial work.

I think it was important to teach the children menial work. It’s a different kind of life. I can’t tell my friends how to live the hard life that we had. The children, our children had. But I think that’s important.

Probably.

Yes, it’s a big one.

Right.

Yes.

Well, I don’t look at it as a perfection thing. I look at it as what a person is at the time. But being able to give the best at that time.

And it’s not necessarily the finest thing. So if a child is 10 years old you know that that’s not the end of his career. But it’s at a point where he can do his very best and give that to the world.

And I think that’s important for what one can do at the time. And it can be a 10 year old or it can be a 30 year old. Or it could be a 40 year old. You could be any age. But you do the best that you can.

Right.

I’m not very interested in art right now. We have a lot of people who have not found art, but conceptual art. And I don’t think that says anything, to me.

Idea-based and they should take it somewhere beyond a concept.

I have always made conceptual ideas, but I want to take them and work on them to finally become something, not just the concept but the idea behind it.

I think the craft is important to a concept. I think to conceive that one works in dough and then that is made into bronze. There are many steps between the concept and the project. And I think that one should experience that. I think that that’s important.

No, they’re entitled to that.

No. I’m expressing it right now. I’m just saying that the young people have, I mean, through technology there’s a lot of new ideas that are way beyond my abilities to do it. And I hope that may be conceptual, but if they take it somewhere beyond my abilities then that’s fine. But if the viewer doesn’t do anything beyond in his mind, and he doesn’t do it beyond the concept, then what good is it.

Powdered dirt, for example. Or brick. That does not appeal to me.

Just I learn from my parents. If I plant a tomato seed I will get a tomato plant out of it. Then I will get tomatoes from that. I like that.

I like the steps that one gets from merely planting a seed, or planting a plant. I like what happens, because you know that you get an eggplant every time you plant an eggplant seed.

Or you know you’re going to get a melon.

I like that.

I like getting a cucumber.

Or what if I’ve got a cucumber and a mixture, a hybrid. I like that too because I’ll get something new. And I like that.

I like to be surprised by a nectarine that is no longer a nectarine.

I’m surprised.

I like nectarine, apricot being put together.

But I guess I want something at the end.

I don’t know if it is.

But I’m curious to know where it will take me.

The next step it will take me.

And it may be something very different from anything you ever imagined.

Well, if you take material you like and you know how far you can take it from what is traditional to do. Like a piece of paper, you like to take it another step.

And if it teaches you some geometry and not just for writing something and you find that you can go from two dimension to three dimension, that interests me.

And it can be any material. It doesn’t have to be wire. It just has to be able to do that.

I think that that’s an important thing.

Right.

It may not last forever.

He does it with snow or he does it with… it melts.

Then I like the idea of it lasting.

So when I cast a face I know I’m just capturing a minute of a person."
AT38,6,2021.0,https://smarthistory.org/do-ho-suh-rubbing-loving/,My energy has been accumulated and in a way I think my rubbing shows that. I’m trying to show the layers of time. I try to understand my life as a movement through different spaces
