id,artist,date,source_url,text
AT62,7,2021.0,https://the-editorialmagazine.com/oscar-yi-hou-kate-wong/,"The phrase ‘sky-licker’ comes from Aimé Césaire’s book-length poem, Cahier d’un retour au pays natal (1939). I first came across it when I read Frantz Fanon’s Wretched of the Earth. My name in Chinese refers to an idiom or chengyu involving a bird cry, which is why I use birds as self-signifiers throughout my practice. A lot of my poetry involves flight or birds – there’s a promise of freedom and boundlessness.

I tried to stay thematically cohesive with this body of work, even as it spans over a year of my life. And so I guess it began fourteen months ago, which is when I first started working towards the exhibition. At the time I was still a student, and I was trapped during lockdown in Liverpool, painting in a tiny room in my childhood home. I wasn’t sure if I’d be able to return to New York to complete my degree. My life is very different now. This show has spanned much grief in my life, but also such joy and communion. I guess that’s where it lands – anew.

At times in my work symbols signify people, like with astrological signs, zodiac signs, or tattoos. I signify myself as a bird throughout my work. I like polysemic symbols. I like using the star symbol because it can signify America when you render it in one context, but it also signifies socialism if you render it another. To give another example, I often dot my works with beads arranged circularly, which come from the Buddhist prayer hand bracelets I would often wear as a kid when I went to China. My parents would also often bring them home as souvenirs. They smelled of sandalwood and I’d wear them to school. I saw them as cute accessories, but they also became a symbol of my diasporic-ness. In my recent show at T293 in Rome I made a painting, Sphincter, aka Two-Pines, that referenced the potentially sphincteral nature of an elasticized beaded bracelet. It’s not to say that I like to decorate my paintings with assholes, but rather, to draw attention to the hidden, multiplicity of meanings a symbol can have. You can give symbols additional meanings by placing them in new contexts and relations. Symbols all dog-whistle differently.

Here I’m dressed as Kato, played by Bruce Lee in the show The Green Hornet that aired in the 60s. Kato was the Green Hornet’s valet and crime-fighting partner. The Green Hornet, of course, was played by a white American man. This piece diverges thematically from the rest of the works in the show. I was interested in what I call yellow iconicity, especially constructions of masculinity within the visual culture of East Asian people. I was looking at 20th century figures like the martial artists Jackie Chan or Bruce Lee, but also more historical figures like the feminized Chinese coolie labourer of the 19th century. I like Kato because of the latent leather Tom of Finland homoeroticism within his costume.

Most of my pieces are titled in a diptych format, using ‘aka’ to divide the title into two. With this piece however, I wanted to use ‘aka’ to draw attention to the fungibility of yellow faces within the West, or the way that people think we all look the same. ‘Also known as’ then might denote the uncanny ability for yellow folks to successfuly disguise ourselves as other yellow folks since apparently no one can fucking tell us apart anyway! Tseng Kwong-Chi is an artist who did mobilised this incredibly well, especially with his ‘Moral Majority’ series.

I moved to New York back in 2017 to begin my undergraduate degree. New York is such a wonderful, diverse, multi-ethnic city. American racial politics are also a lot different than British or European racial politics. I think that being in a city of diasporas, like New York, has certainly solidified my own diasporic identity. Being interpellated as ‘Asian American’ rather than ‘British Born Chinese’ led me to read and study much more about Asian American history and global Chinese movement, which led me in turn to focus much more on issues of diaspora and ethnic-ness within my practice. I also think that in New York, with such class disparity, the old and new relationships between labour and Chinese-ness are more salient. You have elderly Chinese folks picking cans off the street a few blocks down from wealthy international students from Beijing donning Canada Goose. And the recent rise of hate crimes against Asian folks has also reaffirmed what I already felt.

Yes. Living in New York is awesome. I saw the Alice Neel show at the Met Museum this year. One of the works in my show is compositionally based off of a piece I saw at that exhibition. Her work is interesting in the context of what I discussed prior – ethnography, representation, etc.

There’s always things gained and things lost in a move. My grandfather passed back in the Fall of 2018, and so I went back to China for several days to attend the funeral and to support my father. It was the first time I had been to China since I was a kid. When you’re little you can get by with limited Chinese because you’re just fucking around, eating and playing video games. I didn’t need to speak any Chinese to play with my cousins, say. We’d just play Kirby on our GameBoys. Going back as an adult reminded me of how foreign I was to China, and how foreign yet familiar China is to me. I also bought a few art books when I was there, which I studied and incorporated into my practice.

The borders and frames of my paintings express a kind of mediated relation between me and the subject. But between the viewer and the subject, it expresses a kind of ornate plexiglass barrier instead. This feeling of thinking you might get to really know something, grasp something, before quickly realising you will never, is how I felt.

I was thinking a lot about representation. I think representation as politics has been defanged and co-opted for liberal ends. After all, visibility can be a trap, and it can be easily commodified. The art market nowadays is both a symptom and producer of such representationalist ideology. It’s worrying for sure, and lots of my peers feel the same way. It amounts to tokenism, and the commodification of one’s minority-ness. But we also owe our livelihoods to the market, and to the market finally liking our artwork, so it’s an ambivalent relationship.

My work is figurative and representational, and therefore requires that I think a lot about the ethics of representing others. In Can the Subaltern Speak, Indian scholar, Gayatri Spivak, details the dual meaning of ‘represent’ – to re-present, as in to make visible; and to represent, as in to speak-for, in the way a politician speaks for their constituency. These two meanings often overlap in deleterious ways. Does this mean an artist should not represent others? Only themself? Cultural theorist, Rey Chow, outlines this crisis of representation in her text “The Protestant Ethnic & The Spirit of Capitalism”, and she subsequently criticises the excess of self-referentiality in the wake of representation’s ethical crisis. How can we avoid solipsism, and still have empathy for others, whilst avoiding the bad ethics of representation? How do we avoid bad ethnography?

I was in a bit of a rut because I wasn’t really ready to give up representation all together. I like painting other people. So Trinh T. Minh-Ha was formative to my thinking. Rather than to ‘speak about’, famously she opts to ‘speak near’. This got me thinking about the being-with of existence, and how my life is so dependent on others. So for this body of work, rather than painting a singular other person, or a single subjectivity, I’ve instead tried to paint the relation I share with others, an intersubjectivity. Both symbolically and literally. There are a few contemporary texts that talk being-with in the context of queer studies and communism, but I was mainly really drawn to Édouard Glissant. He writes about Relation, but he also writes about hybridity, language, and opacity, all themes which I try and study through my practice.

I hope people will get what I’m about. It’s my first solo in-person show in New York, so hoping folks will catch my vibe.

I cook every day. I mainly make Cantonese dishes. My favourite is steamed whole fish with ginger and scallions, or maybe white cut chicken with ginger scallion sauce!"
AT63,7,2022.0,https://i-d.co/article/oscar-yi-hou-interview/,"The choice to depict someone else is always political. For me, it should be an act of respect and a way to honour the fact that you always live your life with other people, among other people. It’s a way to give testament to the shared, social lifeworld we all live in.

I actually started out drawing a lot of digital fanart with a graphics tablet, specifically of Pokémon. Some of that stuff is probably still floating around the ether. I grew up on the internet and spent my tweens plugged into these relatively wholesome online communities, orbiting Tumblr, chatrooms, and other internet forums, where I’d lie about my age and say I was a teenager (in retrospect, I assume that everyone else was lying too). My parents were also always working in the restaurant, so I was often left to my own devices. I was making art all the time and spending hours on the internet. I’d say that a lot of my basic art education first came from the internet, learning colour theory from sites like DeviantArt.

Once I entered my adolescence, I took Art GCSE and transitioned to physically painting with acrylics. I visited the Tate Liverpool often, and I was introduced to British artists like Francis Bacon and Lucien Freud. I’d learn from them by making studies of their works. On the internet, my interests changed too, and I began to consume countless images of art, photography, films, architecture, etc. I was scrolling through hundreds of beautiful images a day, which I feel really honed an eye for composition and aesthetics. I developed a taste in what I liked and what I didn’t like aesthetically.

I’ve always been interested in people and portraiture. I made many portraits of my friends — for some reason, I always felt like youth was something sacred and slipping away from me, so I always felt inclined to document it. I did a series of paintings of various friends being drunk at house parties. I made these huge photo albums of images I had taken throughout my adolescence, thinking that I would leaf through them in nostalgia one day, though, of course, I haven’t touched them in years. Then I came of age, went to university, and stopped giving a shit about youth!

I actually wanted to go to art school, but in the U.S., they’re incredibly unaffordable for international students. At Columbia, my tuition was basically covered by my financial aid package, so that’s where I ended up going. Ultimately, I’m grateful I got more of a liberal arts education than a specialised art school education — it shaped my art practice for the better.

My parents never really had particular music or film tastes of their own, so it was something I had to find for myself. I was definitely an indie kid growing up, so I grew up on a classic cocktail of indie music and film during the late 00s and 10s. I’d pirate so much film and music. I’d torrent these long-ass playlists from The Pirate Bay to try and discover new bands and sounds.

I was always interested in finding something more than just what was provided to me, and I was consuming so much content. I wasn’t really doing much else besides school, art, and playing video games. This was before Spotify, before content became so formalised, so you really had to venture out into cyberspace and discover things for yourself.

“A sky-licker relation” was my solo show at James Fuentes last year. “Sky-licker” comes from an English translation of an excerpt of Aimé Césaire’s Cahier d’un retour au pays natal. I came across it years back when I was reading Wretched of the Earth by Frantz Fanon. I was struck by the poetics of the phrase — you come across the figure of the bird, and metaphors of flight manifest across many different spheres and artforms. I was recently reading Younghill Kang’s fictionalised memoir, East Goes West: The Making of an Oriental Yankee — he was an important early Asian American writer — and he uses a beautiful metaphor of an “undying bird” that flies “on and on.” And in one of my favourite collections of poetry, A Coney Island of the Mind by Lawrence Ferlinghetti, who recently passed last year, there are so many birds — my favourite are his “moonmad swans.”

I’ve always felt a particular affinity for the idea of flight. It’s something I explore within my poetry, too. And throughout my body of work, I use the figure of the bird as a signifier for myself, in reference to my given Chinese name, which comes from an idiom involving a bird’s cry. So, in brief, the title “a sky-licker relation” speaks to how these portraits are all expressions of the relationships that I share with people.

I wanted to try and be as responsible as possible in my representations of other people. I was driven by questions such as: who gets to represent whom? Who gets to speak on behalf of whom? So, rather than painting a lone subject, which would be to “speak for,” I wanted to instead the depict the relationship that I share with the sitter, which is instead to “speak near” or “speak with.” I was inspired by the thought of filmmakers like Trinh T. Minh-ha. I was also inspired by the poet Frank O’Hara’s manifesto on “Personism,” which is, to summarise, about painting as a form of address to the other.

So in this body of work, I only painted people I had a particular relationship with. You can see this symbolically in my works. There are a variety of symbolic languages I draw from, such as astrology, the zodiac, or any tattoos the subject might have. For example, in “A crane and two sea-goats walk into a bar, aka: Summertime Cosmogony on Old Broadway (2021),” the two subjects depicted are both capricorns. They’re dating, so I depicted them as a two-headed sea-goat. Above, I depicted a crane. The juxtaposition of the goat and crane represents our shared friendship. The motif of three-ness is also seen throughout the piece.

In other pieces, there are fragments of poems that I wrote about the relation I have with the subject.

I always begin with the eyes — I’m a sucker for eyes. Before that, though, I do a sketch or two and draft up a rough composition for what I want the piece to look like. And I’ll do a drawing with some gouache directly onto the canvas to help guide the work.

I get very single-minded once I start rendering the face. Even though it requires the most work, precision, and thought, I’ll often lose myself and can often complete it within the week. It’s the most fun and is always a joy. I’m always very intentional with which hues to use, and the shape I want each brushstroke to create.

In my day-to-day life, I’m not known to be a very frenetic person, but sometimes within a painting, you have move quick in order to give some weight to the more slow moments.

Beginning my career during a pandemic has been a little crazed. It forced me to hustle a lot more. Last year was a ton of work, as I produced those three shows and also completed my final year of undergrad. It’s hard to really delineate the way that these past few years have shaped me as an artist, because the disruption the pandemic wreaked also significantly shaped — and continues to shape — my post-graduation life. The last two years of my degree were over Zoom; I had one of those silly little Zoom graduations. It’s a little sad to think that I don’t really know what young adulthood was like before, because adulthood during a pandemic is all I’ve ever known. I’m fortunate because art-making is a generally solitary affair, and I’m self-employed. My peers and other recent grads have had it far worse. I’m very grateful to be able to do what I do."
AT64,7,2023.0,https://www.wnycstudios.org/podcasts/all-of-it/segments/artist-oscar-yi-hou-questions-asian-and-american,"The poem essentially conjures up this mythic space of being in between these two huge celestial bodies, the sun and the moon seen as metaphors for the east and the west.

Yes. It's on the wall as part of the exhibition. Me and Eugenie talked about putting the actual poem onto the wall as an artwork into itself. The poem goes.

Is this on? Yes, fly too close.

You have everything to gain and only loftiness to lose.

In this intermediary puddle

Between those two great poles they staked out long before you were born

West of moon, all right, hold your breath, baited deep diving for crabs.

I remember now, you were never a strong swimmer

Knees deep staring the [unintelligible] body down

Against the walk and works of the reeds and tides as you wade further afield [unintelligible].

Actually, so I wrote a proposal for the show. When I first found out that I was supposed to write a proposal for the show, I was pretty overwhelmed at first. I didn't know what to do. Then I went into museum to think of some ideas, and then I came up with this poem and it just made sense. It drove the whole project of the show. It was very dear to my heart this poem because it spurred the whole enterprise, and it made a lot of sense for me just to include it as part of the show.

Yes, it happens in a writing.

During the same time, I was also in the process of writing essays for a book that I published with my gallery, James Fuentes, on that press, James Fuentes Press. All these ideas were already fermenting in my head. Then when I found out that I was going to submit a proposal, I was already in a writing mood. I just kept flowing and a lot of the ideas from the book bled into the show proposal and vice versa. Yes, it was honestly a really nice time. It was like a month or two, just writing in my studio.

Oh, I mean, I'm so grateful, first and foremost, to UOVO and also Eugenie, as well. It was a huge game changer, especially, early on in my career to see firstly, my financial prize, and also to have an institutional show, and it gave me the opportunity to have such a show in such an amazing institution was such a dream come true. It's really hard to I guess overstate it. I feel incredibly privileged and happy. It definitely significantly altered the course of my career I think, so it’s been a huge privilege and a huge blessing.

I think the boundary between high and low visual culture, for me, it's very blurred and it's all the same. I think as an artist, as a visual worker, I'm looking at visual culture and that encompasses all aspects of visual culture. I watched anime growing up. I watched Dragon Ball Z, all those things as well as more things that are seen as lofty and high art for example. It makes sense for me to explore all facets of visual culture, especially when it comes to representation.

One of the pieces in the show is a portrait of myself dressed as Goku from Dragon Ball Z. I became really interested in Goku and anime as a kind of interface between the East and the West, specifically Japan post World War II, the ways in which Japan developed a really strong culture industry following its decline and then rise. The show is about East of sun, west of moon, the kind of between this and the meetings of these two things. I became interested in examining these forms of popular culture as a way to explore greater ideas between culture industries or, I don't know, geopolitical relations.

That's a good question. I think sometimes I'll have a idea for a piece, oftentimes we based off a previous image, different artwork. Sometimes I think title of a work then I base the whole painting around the title. I tend to paint the same people over and over just because they are good friends of mine and they know how to do it and stuff. I guess that’s—

They know how to pose, [unintelligible] being my studio. I actually don't know how to answer the question. I think it's very much based on intuition and feeling whether a person's going to make sense for a piece.

This is why I only work with my friends is because when I'm painting someone else, I want everyone to feel as comfortable as possible and to not feel transactional. It's based off our existing relationship. That's generally why I work with friends and close friends so it's a very comfortable environment to be in.

Yes.

Yes and the object I reference is two tigers in reference to me and Sasha both being Year of the Tiger in our Zodiac.

I guess whole body of work, I've always been looking at the past and looking at these objects within Asian art collections. I guess from a diasporic perspective experiencing my ""ancestral culture"" so to speak, from these Western institutions. It made sense when I found out that I could be doing this Brooklyn Museum show to incorporate Asian objects within the Brooklyn Museum collection just to make it a bit more site-specific.

Yes.

It really varies. A lot of the figures are actually similar size. Generally, the face is just smaller than the span of my hand. That's how I measure around.

But there's one painting in the show, for example, Old Gloried Hole, aka: Ends of Empire, which is a markup of the American flag and that's seven feet tall, almost seven feet tall. I wanted that to really have this huge sense of scale. I wanted to produce some more monumental work for the show and obviously have all the vertical lines of the flag, we have the figure in the bottom right and the shadow being cast. That's a piece where I was very specifically thinking about scale and size and the sense of meaningness.

It's actually very boring. It's very iconical. I painted myself a lot because self-representation is one thing, but it's also very convenient. I don't have to schedule someone to come in. I just compose myself in the most grotesque poses possible. I can strip myself down. I can very much manhandle myself. There's that protocol of care that I feel like I have to do when it's myself. That's why with that body of work, you have this pinup beefcake figures in a way that they're sexualized. I feel comfortable doing to a figure that isn't based off anyone in particular. It's more reference of myself because it feels like I can just manipulate my own likeness in a way that I just care less about whether it looks like me.

Well, I think I'm not from America. When I came to the States, I came for college, I was very much aware of Americanness. I didn't take it for being the standard. It was something else, something new that I had to counter and learn about. Coming at it from an outside perspective, I became really interested in America as an object of studying and became really fascinated with it. I think a lot of my work actually deals with Americanness and not really Britishness I think because I was really interested in America and the American project as an outsider."
AT65,7,2024.0,https://officemagazine.net/oscar-yi-hou-sets-reality-center-stage,"My first show with James, I’d just graduated college and I was really interested in academia and theory.

Academia and theory heavily informed my practice. They still do now. But, this was prior to having lived life as an independent adult. As the years passed since graduation, a lot of the theory that I was reading started to be less applicable and less relevant.

Nightlife and putting myself out there.

Having sex — at least for gay men or queer men, that is a great way to make friends.

I can actually refuse any kind of closed meaning or thesis in whatever I make.

Was there a leather daddy back in the 1800s working in the mines? Probably not.

It can be a burden to think about these things, but it's also quite generative.

I was interested in the ethics of portraiture and trying to not commit any symbolic violence to another person through a painting.

As I got older, I was like, ‘wait, none of my sitters give a shit about that.’

I've been interested in opacity and obscurity, generating mystery or opacity through these symbols.

Because I've talked so much about them, they're a bit transparent now.

To further obfuscate the meaning behind them.

I can actually refuse any kind of closed meaning or thesis in whatever I make.

That's what I was doing with this body of work — the work inherently has a kind of politics and thinking behind it, but I feel it was less didactic and a lot more free."
